{
  "schema_version": 1,
  "generated_by": "scripts/discover_skills.py",
  "retrieved_at": "2026-10-26",
  "skills": [
    {
      "id": "github/amossse/nextstep",
      "name": "nextstep",
      "description": "One next action. An original offline action-map Agent Skill with private resumable progress.",
      "category": "external-unclassified",
      "source_url": "https://github.com/Amossse/nextstep",
      "repository_url": "https://github.com/Amossse/nextstep",
      "revision": "unresolved",
      "license": "MIT",
      "compatibility": [
        "unverified"
      ],
      "last_reviewed": null,
      "review_status": "pending-human-review",
      "risk_notes": "Not reviewed. Do not install or execute until a human has read every file.",
      "related_skills": [],
      "author": "Amossse",
      "retrieved_at": "2026-10-26",
      "redistribution": "permitted-by-license",
      "flags": [
        "inspection-failed"
      ]
    },
    {
      "id": "github/blizzardblast/frey-skills",
      "name": "frey-skills",
      "description": "A collection of practical, production-ready AI agent skills for the skills.sh ecosystem.",
      "category": "production",
      "source_url": "https://github.com/BlizzardBlast/frey-skills",
      "repository_url": "https://github.com/BlizzardBlast/frey-skills",
      "revision": "unresolved",
      "license": "MIT",
      "compatibility": [
        "unverified"
      ],
      "last_reviewed": null,
      "review_status": "pending-human-review",
      "risk_notes": "Not reviewed. Do not install or execute until a human has read every file.",
      "related_skills": [],
      "author": "BlizzardBlast",
      "retrieved_at": "2026-10-26",
      "redistribution": "permitted-by-license",
      "flags": [
        "inspection-failed"
      ]
    },
    {
      "id": "github/burtson-labs/ui",
      "name": "ui",
      "description": "Burtson UI: accessible React components on Radix and Tailwind, with Burtson Icons built in. Install the package or copy the source.",
      "category": "frontend",
      "source_url": "https://github.com/Burtson-Labs/ui",
      "repository_url": "https://github.com/Burtson-Labs/ui",
      "revision": "27e251532fc19dead6ee412d87371bcf996820a3",
      "license": "MIT",
      "compatibility": [
        "unverified"
      ],
      "last_reviewed": null,
      "review_status": "pending-human-review",
      "risk_notes": "Not reviewed. Do not install or execute until a human has read every file.",
      "related_skills": [],
      "author": "Burtson-Labs",
      "retrieved_at": "2026-10-26",
      "redistribution": "permitted-by-license",
      "flags": [
        "inspection-failed"
      ]
    },
    {
      "id": "github/cyvid7-darus10/repo-explainer",
      "name": "repo-explainer",
      "description": "Turn any codebase into a guided, interactive tour: architecture map, end-to-end flows with file:line, and what changed and why. An agent skill with a zero-dependency CLI.",
      "category": "external-unclassified",
      "source_url": "https://github.com/Cyvid7-Darus10/repo-explainer",
      "repository_url": "https://github.com/Cyvid7-Darus10/repo-explainer",
      "revision": "unresolved",
      "license": "Apache-2.0",
      "compatibility": [
        "unverified"
      ],
      "last_reviewed": null,
      "review_status": "pending-human-review",
      "risk_notes": "Not reviewed. Do not install or execute until a human has read every file.",
      "related_skills": [],
      "author": "Cyvid7-Darus10",
      "retrieved_at": "2026-10-26",
      "redistribution": "permitted-by-license",
      "flags": [
        "inspection-failed"
      ]
    },
    {
      "id": "github/dertin/vulnbell",
      "name": "vulnbell",
      "description": "Security monitoring and clear reports for your software, using your local agent.",
      "category": "security",
      "source_url": "https://github.com/dertin/vulnbell",
      "repository_url": "https://github.com/dertin/vulnbell",
      "revision": "unresolved",
      "license": "MIT",
      "compatibility": [
        "unverified"
      ],
      "last_reviewed": null,
      "review_status": "pending-human-review",
      "risk_notes": "Not reviewed. Do not install or execute until a human has read every file.",
      "related_skills": [],
      "author": "dertin",
      "retrieved_at": "2026-10-26",
      "redistribution": "permitted-by-license",
      "flags": [
        "inspection-failed"
      ]
    },
    {
      "id": "github/dicklesworthstone/meta_skill",
      "name": "meta_skill",
      "description": "Local-first skill management platform for AI coding agents: dual SQLite+Git persistence, semantic search, bandit-optimized suggestions, and MCP integration",
      "category": "external-unclassified",
      "source_url": "https://github.com/Dicklesworthstone/meta_skill",
      "repository_url": "https://github.com/Dicklesworthstone/meta_skill",
      "revision": "unresolved",
      "license": "UNKNOWN",
      "compatibility": [
        "unverified"
      ],
      "last_reviewed": null,
      "review_status": "link-only",
      "risk_notes": "Heuristic indicators found: credential-file-access, pipe-to-shell, privilege-escalation. Human review required; do not install.",
      "related_skills": [],
      "author": "Dicklesworthstone",
      "retrieved_at": "2026-10-26",
      "redistribution": "link-only",
      "flags": [
        "bundled-scripts-present: review manually, never execute during review",
        "heuristic:credential-file-access",
        "heuristic:pipe-to-shell",
        "heuristic:privilege-escalation",
        "inspection-failed",
        "licence-unclear-or-restrictive: catalogue and link only",
        "manual-review-required",
        "skill-files-inspected:5"
      ]
    },
    {
      "id": "github/dpalfery/kyber-weave",
      "name": "kyber-weave",
      "description": "Agentic coding framework and meta-harness for planning, building, reviewing, and tuning software across coding agents. Portable agent squads, skills, governed project knowledge, quality gates, and local token observability. Human judgment. Agent speed.",
      "category": "engineering",
      "source_url": "https://github.com/dpalfery/kyber-weave",
      "repository_url": "https://github.com/dpalfery/kyber-weave",
      "revision": "unresolved",
      "license": "MIT",
      "compatibility": [
        "unverified"
      ],
      "last_reviewed": null,
      "review_status": "pending-human-review",
      "risk_notes": "Not reviewed. Do not install or execute until a human has read every file.",
      "related_skills": [],
      "author": "dpalfery",
      "retrieved_at": "2026-10-26",
      "redistribution": "permitted-by-license",
      "flags": [
        "inspection-failed"
      ]
    },
    {
      "id": "github/ejryan89/coding-agent-skills",
      "name": "coding-agent-skills",
      "description": "Portable agent skills with a guarded deployer for Claude Code, Codex, and GitHub Copilot",
      "category": "production",
      "source_url": "https://github.com/EJRyan89/coding-agent-skills",
      "repository_url": "https://github.com/EJRyan89/coding-agent-skills",
      "revision": "875df964a0c285a74e4bee4e9d08c00c73248b83",
      "license": "MIT",
      "compatibility": [
        "unverified"
      ],
      "last_reviewed": null,
      "review_status": "pending-human-review",
      "risk_notes": "Not reviewed. Do not install or execute until a human has read every file.",
      "related_skills": [],
      "author": "EJRyan89",
      "retrieved_at": "2026-10-26",
      "redistribution": "permitted-by-license",
      "flags": [
        "inspection-failed"
      ]
    },
    {
      "id": "github/enamtiga/motion-craft",
      "name": "motion-craft",
      "description": "Agent Skill: After Effects-grade motion graphics video production, 8 phases, evidenced 5-gate QA, music and SFX synthesized from code, cues.json as the single source of timing",
      "category": "production",
      "source_url": "https://github.com/EnamTiga/motion-craft",
      "repository_url": "https://github.com/EnamTiga/motion-craft",
      "revision": "unresolved",
      "license": "MIT",
      "compatibility": [
        "unverified"
      ],
      "last_reviewed": null,
      "review_status": "pending-human-review",
      "risk_notes": "Not reviewed. Do not install or execute until a human has read every file.",
      "related_skills": [],
      "author": "EnamTiga",
      "retrieved_at": "2026-10-26",
      "redistribution": "permitted-by-license",
      "flags": [
        "inspection-failed"
      ]
    },
    {
      "id": "github/faustojdb/researchmatch",
      "name": "ResearchMatch",
      "description": "",
      "category": "external-unclassified",
      "source_url": "https://github.com/faustojdb/ResearchMatch",
      "repository_url": "https://github.com/faustojdb/ResearchMatch",
      "revision": "unresolved",
      "license": "UNKNOWN",
      "compatibility": [
        "unverified"
      ],
      "last_reviewed": null,
      "review_status": "link-only",
      "risk_notes": "Not reviewed. Do not install or execute until a human has read every file.",
      "related_skills": [],
      "author": "faustojdb",
      "retrieved_at": "2026-10-26",
      "redistribution": "link-only",
      "flags": [
        "inspection-failed",
        "licence-unclear-or-restrictive: catalogue and link only"
      ]
    },
    {
      "id": "github/juli-amezquita/skill-security-reviewer",
      "name": "skill-security-reviewer",
      "description": "Security review for third-party Claude skills and plugins before you install them. Deterministic preflight + guided semantic audit: prompt injection, agent-tool abuse, load-time execution, hidden Unicode, exfiltration. Zero dependencies.",
      "category": "security",
      "source_url": "https://github.com/juli-amezquita/skill-security-reviewer",